[
  {
    "schema_id": "emergentism/MysteryDiagnosis.v1",
    "diagnosis_id": "MTA54@1:MET:GROUND",
    "problem_id": "PQA54@0.1:MET:GROUND",
    "pqa_row_sha256": "bf5da66a915348e89141aa9645e00cc39b1c92c655b160752c82a4de555f0426",
    "native_problem": "Ground, sufficient reason and explanatory termination.",
    "diagnosis_state": "PARTIAL_TYPE_COLLISION",
    "primary_collision_id": "TCX-01",
    "secondary_collision_ids": [],
    "answer_mode": "CONSTITUTIVE_REFRAME",
    "proposed_effect": "REFRAME",
    "earned_effect": "NO_INCREMENT",
    "result_state": "SELECTED_UNREVIEWED",
    "diagnostic_claim": "Candidate Ground and object collision: Treat an explanatory boundary as another object, cause, or member inside the domain it bounds.",
    "alleged_invalid_join": "Treat an explanatory boundary as another object, cause, or member inside the domain it bounds.",
    "repaired_formulation": "Keep the boundary role separate from any positive object or causal hypothesis.",
    "legitimate_bridge": "declare a stronger metalanguage; supply a native necessary-being argument",
    "emergentist_answer": "Emergentism places a GROUND_BOUNDARY where object-language explanation no longer has a lawful target; it does not turn Ground into an object or necessary being.",
    "linked_answer_ids": [
      "EA-01"
    ],
    "native_target_preservation": "PRESERVED",
    "strongest_native_rival": "The native ground, sufficient reason and explanatory termination. literature plus generic decomposition explains the issue more faithfully and with less imposed vocabulary.",
    "generic_control": "Separate terms, levels, carriers, warrants and residuals without using Emergentist vocabulary.",
    "discriminator": "Two blinded native-domain reviewers must find incremental clarification or resolution beyond both controls while every premise and residual remains visible.",
    "kill_criterion": "No result is earned if the question changes, a premise or residual disappears, the native account is distorted, review quorum is absent or the proposal adds no value over both controls.",
    "cheapest_next_test": "One blinded native-domain comparison against both the native frame and generic seven-axis decomposition.",
    "survivor_if_killed": "The native problem, references, public denominator and explicit debt remain.",
    "residual_debt": "Why that boundary rather than a brute fact or necessary truth remains open.",
    "split_integrity": "CONTAMINATED_FOR_FOURTH_USE"
  },
  {
    "schema_id": "emergentism/MysteryDiagnosis.v1",
    "diagnosis_id": "MTA54@1:MET:ONE_MANY",
    "problem_id": "PQA54@0.1:MET:ONE_MANY",
    "pqa_row_sha256": "87651c3f50c28069b65cfb6ed99ef872ea20c855c96c3ee8ebe318a8d5d74bae",
    "native_problem": "Unity, plurality and dependence without erasure.",
    "diagnosis_state": "PARTIAL_TYPE_COLLISION",
    "primary_collision_id": "TCX-06",
    "secondary_collision_ids": [],
    "answer_mode": "TYPE_DIAGNOSIS",
    "proposed_effect": "CLARIFICATION",
    "earned_effect": "NO_INCREMENT",
    "result_state": "SELECTED_UNREVIEWED",
    "diagnostic_claim": "Candidate Part, bearer and whole collision: Transfer identity, consent, benefit, harm, or standing between a part and a whole without an explicit aggregation or representation rule.",
    "alleged_invalid_join": "Transfer identity, consent, benefit, harm, or standing between a part and a whole without an explicit aggregation or representation rule.",
    "repaired_formulation": "Keep bearer-horizon rows separate and defend any aggregation or proxy mandate.",
    "legitimate_bridge": "index every affected bearer; declare aggregation and representation mandates",
    "emergentist_answer": "Typed levels allow one coherent whole and genuine plural situated bearers without identifying either with the other.",
    "linked_answer_ids": [
      "EA-01"
    ],
    "native_target_preservation": "PRESERVED",
    "strongest_native_rival": "The native unity, plurality and dependence without erasure. literature plus generic decomposition explains the issue more faithfully and with less imposed vocabulary.",
    "generic_control": "Separate terms, levels, carriers, warrants and residuals without using Emergentist vocabulary.",
    "discriminator": "Two blinded native-domain reviewers must find incremental clarification or resolution beyond both controls while every premise and residual remains visible.",
    "kill_criterion": "No result is earned if the question changes, a premise or residual disappears, the native account is distorted, review quorum is absent or the proposal adds no value over both controls.",
    "cheapest_next_test": "One blinded native-domain comparison against both the native frame and generic seven-axis decomposition.",
    "survivor_if_killed": "The native problem, references, public denominator and explicit debt remain.",
    "residual_debt": "The metaphysical dependence relation is not thereby proved.",
    "split_integrity": "CONTAMINATED_FOR_FOURTH_USE"
  },
  {
    "schema_id": "emergentism/MysteryDiagnosis.v1",
    "diagnosis_id": "MTA54@1:MET:UNIVERSALS",
    "problem_id": "PQA54@0.1:MET:UNIVERSALS",
    "pqa_row_sha256": "210b9adb9d166a55258429f1342af81205bc53126566ee0a1b13dfce5565c01e",
    "native_problem": "Realism, nominalism and trope theories of universals.",
    "diagnosis_state": "PARTIAL_TYPE_COLLISION",
    "primary_collision_id": "TCX-05",
    "secondary_collision_ids": [],
    "answer_mode": "TYPE_DIAGNOSIS",
    "proposed_effect": "CLARIFICATION",
    "earned_effect": "NO_INCREMENT",
    "result_state": "SELECTED_UNREVIEWED",
    "diagnostic_claim": "Candidate Type and token collision: Admit a classifier or metalanguage resource as an ordinary token subject to the same unrestricted self-application.",
    "alleged_invalid_join": "Admit a classifier or metalanguage resource as an ordinary token subject to the same unrestricted self-application.",
    "repaired_formulation": "Separate levels or restrict formation while preserving every valid lower-level expression.",
    "legitimate_bridge": "stratify levels; restrict formation or comprehension",
    "emergentist_answer": "Repeatable properties may be tracked as invariants across transformations while their nominalist, realist or trope ontology remains open.",
    "linked_answer_ids": [
      "EA-07"
    ],
    "native_target_preservation": "PRESERVED",
    "strongest_native_rival": "The native realism, nominalism and trope theories of universals. literature plus generic decomposition explains the issue more faithfully and with less imposed vocabulary.",
    "generic_control": "Separate terms, levels, carriers, warrants and residuals without using Emergentist vocabulary.",
    "discriminator": "Two blinded native-domain reviewers must find incremental clarification or resolution beyond both controls while every premise and residual remains visible.",
    "kill_criterion": "No result is earned if the question changes, a premise or residual disappears, the native account is distorted, review quorum is absent or the proposal adds no value over both controls.",
    "cheapest_next_test": "One blinded native-domain comparison against both the native frame and generic seven-axis decomposition.",
    "survivor_if_killed": "The native problem, references, public denominator and explicit debt remain.",
    "residual_debt": "What makes an invariant ontologically real remains disputed.",
    "split_integrity": "CONTAMINATED_FOR_FOURTH_USE"
  },
  {
    "schema_id": "emergentism/MysteryDiagnosis.v1",
    "diagnosis_id": "MTA54@1:MET:IDENTITY",
    "problem_id": "PQA54@0.1:MET:IDENTITY",
    "pqa_row_sha256": "09e9f18693cefa34def402248853906a2faff909c1214df03863ac655bbd3079",
    "native_problem": "Numerical identity, continuity, constitution and persistence.",
    "diagnosis_state": "PARTIAL_TYPE_COLLISION",
    "primary_collision_id": "TCX-10",
    "secondary_collision_ids": [],
    "answer_mode": "TYPE_DIAGNOSIS",
    "proposed_effect": "CLARIFICATION",
    "earned_effect": "NO_INCREMENT",
    "result_state": "SELECTED_UNREVIEWED",
    "diagnostic_claim": "Candidate Trace, identity and survival collision: Infer continuing bearer identity or experience from a surviving trace, effect, record, or selected continuity alone.",
    "alleged_invalid_join": "Infer continuing bearer identity or experience from a surviving trace, effect, record, or selected continuity alone.",
    "repaired_formulation": "Separate actuality retention, trace persistence, continuity, identity, and survival.",
    "legitimate_bridge": "declare the identity criterion; test bearer continuity through fission and interruption",
    "emergentist_answer": "Identity claims must declare which continuity—material, causal, structural, functional, narrative or authorized—carries the same bearer.",
    "linked_answer_ids": [
      "EA-05"
    ],
    "native_target_preservation": "PRESERVED",
    "strongest_native_rival": "The native numerical identity, continuity, constitution and persistence. literature plus generic decomposition explains the issue more faithfully and with less imposed vocabulary.",
    "generic_control": "Separate terms, levels, carriers, warrants and residuals without using Emergentist vocabulary.",
    "discriminator": "Two blinded native-domain reviewers must find incremental clarification or resolution beyond both controls while every premise and residual remains visible.",
    "kill_criterion": "No result is earned if the question changes, a premise or residual disappears, the native account is distorted, review quorum is absent or the proposal adds no value over both controls.",
    "cheapest_next_test": "One blinded native-domain comparison against both the native frame and generic seven-axis decomposition.",
    "survivor_if_killed": "The native problem, references, public denominator and explicit debt remain.",
    "residual_debt": "No universal criterion of persistence follows.",